Comment_ID,Author,Score,Text
jts34xu,DeltaBot,1,"/u/Iron-Patriot (OP) has awarded 3 delta(s) in this post.

All comments that earned deltas (from OP or other users) are listed [here](/r/DeltaLog/comments/15bruqo/deltas_awarded_in_cmv_global_warming_will_not_be/), in /r/DeltaLog.

Please note that a change of view doesn't necessarily mean a reversal, or that the conversation has ended.

^[Delta System Explained](https://www.reddit.com/r/changemyview/wiki/deltasystem) ^| ^[Deltaboards](https://www.reddit.com/r/changemyview/wiki/deltaboards)"
jts1kgg,yyzjertl,197,This view sets up a false dichotomy. The most viable option to address climate change is significant government regulation on industry to change production-side emissions and fossil fuel production. This is not an incremental change to our way of life (since it has little to do with lifestyle) nor does it involve a technological breakthrough.
jtsi226,DreamingSilverDreams,104,"I think what you are suggesting is ultimately 'sciencing our way out of climate change' and this is unlikely to work because we are running out of time.

Scientific breakthroughs will happen, there is no doubt about it. However, it may take years to test, optimise, commercialise, and implement new technologies and solutions. It took almost a century for modern solar and wind technologies to mature: Both initially appeared at the end of the 19th century (1880s).

The first breakthrough in nuclear fusion happened last year in December. It was a 5s experiment that produced a tiny bit of surplus energy. When the fusion technology is ready for commercialisation/widespread use, climate change will be irreversible and impossible to mitigate if we continue business-as-usual and hope to solve everything with nuclear fusion.

There were zero experiments on changing the Earth's albedo (your glitter in the troposphere) and no one knows or can predict with a high degree of certainty what will happen even in the short term. I am not sure it is a good idea to hope for the best and just roll the dice.

CO2 capture and storage (CCS) is currently commercially unviable and requires changes in regulations to become viable. There are also concerns about possible leaks. CCS would also require large investments in its infrastructure (scrubbers, pipes, storage, etc.). Most importantly, this technology does not address the source of the problem, it only deals with the symptoms and can potentially promote further increases in CO2 emissions.

As for small changes in consumer behaviours, I think they will not work, too. They are too small.

Most scientific papers I read suggest that the best way (if not the only way) to mitigate climate change (at this point no one talks about reversing it) is through swift and radical changes in regulations. Governments need to take action because only they have the power to force changes on a global scale.

EDIT: u/HughJazzKok in the comments points out that the nuclear fusion experiment resulted in some excess energy, but the net energy in the entire system is not surplus. If it is the case (I am not a physicist and have to rely on newspaper reporting), we are even further from the practical implementation than I originally thought."
jts29fc,Brakasus,43,">Seriously, does anyone actually think this will fix things?

Yes.

>I mean to say that small changes to be more environmentally friendly such as buying a hybrid vehicle or eating less meat are next to useless.

Electric vehicles themselves don't change anything. In combination with solar and wind energy this story changes, though. Both, EVs and renewable energies have seen steady marginal growth. It'd ease my mind if the growth was more vigorous, but it is growing and improving at least and it creates an economical alternative to the current status quo thats fossil energy. Technological change in history always followed this slow marginal growth pattern, as well. The industrial revolution took hundreds of years and we still saw the highest amounts of growth in the last decades, meaning it isn't done yet.

If anything, its exactly the reluctance to embrace this -marginal but hard- path, which you show here in your approach that is very common among most people, which seriously holds politics back from more quickly phasing out environmentally harmful technologies. Because, what if some technology comes around the corner that makes driving cars ok, again? Then all this change was for nothing, right?

Well, historically speaking at least, nothing like this has ever happened. The real difficulty in quickly changing the world lies in quickly changing humans, which is impossible. Case in point, we have two incredibly efficient means of transportation that have actually been phased out of use in the last 70 years: The bike and the train. Humans are super efficient when it comes to movement and putting a human on a bike on a road is litteral efficiency heaven, nothing compares. Conversely, if you do want to go faster than by bike, and boats are still too slow for you, then the next most efficient mode is the train, since it leverages the efficiencies that come from moving many people at once and it takes advantage of most people traveling between the same places anyway. So here is my question back to you, why isn't the western world filled to the brim with these two killer technologies which are clearly superior to car and plane in the majority of cases and which go a long way in stopping climate change?"
jtrzs9j,FaerieStories,45,"> I mean to say that small changes to be more environmentally friendly such as buying a hybrid vehicle or eating less meat are next to useless. Seriously, does anyone actually think this will fix things?

The answer is 'yes', because the science is behind it. Do you have any evidence to back up your views?

[https://www.theguardian.com/environment/2023/jul/20/vegan-diet-cuts-environmental-damage-climate-heating-emissions-study](https://www.theguardian.com/environment/2023/jul/20/vegan-diet-cuts-environmental-damage-climate-heating-emissions-study)"
jtsyabs,taralundrigan,31,"People who say this don't understand climate change or the absolute damage we have wrecked on earth.

No, a ""big fantastic technological breakthrough"" is not going to be what solves climate change, biodiversity loss andd habitat destruction, the depletion of our topsoil, the death of our coral reefs or deal with 40°C ocean temperatures. 

The only way to turn this shit around is for people to re-define what a good quality of life is. We can't be mindless consumers anymore. Our society is structured completely wrong. 

The reality is there isn't a solution the majority is ever going to agree on and well run this ship right into the ground. This should have been mainstream news 20-30 years ago and anytime a politican comes around that actually focuses on the climate, arguably the **only** thing that matters right now, the people either don't vote for them or they get screwed by corruption."
jts0i4o,Jebofkerbin,27,"We have the technology to go net zero now, it's just a case of money, infrastructure, and political will. The idea that some brilliant breakthrough in tech will save us is a dream of people who don't want any solution that challenges the status quo. For example a ban on ICE vehicles and a reduction in the number personal vehicles on the road is something that is almost definitely necessary to reduce our emissions, but people really hate the idea of losing their gas guzzling truck so they are attracted to a future where they can keep living exactly as they are but the clouds are sparkly or whatever."
jts24ls,OptimisticRealist__,14,"Its both.

On one hand people need to change their lifestyles. Less meat consumption, not buying new clothes every other day, take public transport or walk, no cruises etc.

Just look at the US - the US is incredibly wasteful with its hyperconsumerism, on a per capita basis (obviously a more meaningful metric) the US is a bigger pollutor than China and India combined. 

At the same time, we need a moonshot tech, something along the lines of carbon capture, to be able to not make climate change worse"
jts1ee2,tipoima,11,"All the ""fantastic technological breakthroughs"" are just bandaids that only delay the issue instead of solving it (while also encouraging the same kind of emissions that caused the problem).   
The real way to solve climate change is to just stop consuming 60%-70% of our energy demand. Except that would pretty much end all cars, butcher industry and agriculture, make consumer goods obscenely expensive, e.t.c. And no country would agree to subject itself to that, much less the entire world.  
I believe we will not solve global warming. Billions will be displaced and die in the next century or two. Human civilization will massively shrink. And then maybe their emissions will be small enough so they can actually solve it without waiting for millions of years of natural processes."
jtryr2v,_Dnikeb,7,You want to blast glitter in the troposphere? what?
jtsdlgg,Agentbasedmodel,8,"There is a fallacy here, right. You consider small incremental behaviour changes but transformative tech. 

What is needed are systemic transformations in our economic structures. Big changes in our way of life.

From throwing stuff away, we need a circular economy.

Hybrid cars etc aren't a sufficient climate solution. But public transit is. 

Eating vegetarian (not just a bit less meat) is vital to free up land for ecosystem restoration and tree planting. 

Etc."
jts30o6,poprostumort,7,">In regards to the former, I mean to say that small changes to be more environmentally friendly such as buying a hybrid vehicle or eating less meat are next to useless. Seriously, does anyone actually think this will fix things?

Of course it's what solves the issue, because that is what is always solving the issues - small, piecemeal, incremental changes to our way of life that prompt more study into these avenues, more small, piecemeal, incremental technological changes - all of that will add up into an actual breakthrough. Breakthrough that will not be a one big tech that solves the problem, but a plethora of small changes and techs that would solve the issue.

If you buy a hybrid vehicles, there is market for them. So companies need to invest in hybrids/EV and tech around it to make a more compelling hybrid/EV for people to buy. This leads to R&D funding and more incremental changes - until you come to a point where electric motor and batteries are good enough to power ANY vehicle. At that market pursuing selling EV cars made enough tech changes that  electric motor can be used in major polluters - electric trucks, electric ships, electric planes. And they will be powered by renewable energy as competition in that sector is doing the same - making costs og generating energy lower and lower. 

>And by ‘big technological breakthrough’ I mean something along the lines of blasting glitter into the troposphere to block out the sun or using fusion power to scrub carbon out of the air to later be buried underground. We are the human race and we’re nothing if not flexible and adaptable when push comes to shove.

You know that in human history issues were rarely, if ever, resolved by a big technological breakthrough. They were solved by someone inventing new way of doing X that was less capable but promising, people investing into it and tech slowly getting better and better until old way that was problematic was dropped because it was obsolete.

Can you name any issue that was resolved by sudden breakthrough?"
jtrzgw3,Z7-852,5,"World biggest polluters are fossil fuel industry, agriculture and fashion. All these industries are profit driven entities. They are not polluting because it's fun or they are evil. They are doing it because it makes them bank.

Now do your few ten thousand bucks a year make a different in their bottom line? No it doesn't. But if thousands or millions stop using their products? Well that will kill these industries and pollution with them. This is ""my vote doesn't matter"" debate but it always does."
jts1csl,Deleted,4,[removed]
jtwscfw,passingby,3,I follow this stuff very closely and I am absolutely shocked at how uninformed all these thoughts/opinions are. People are just speaking out their butts.
jts0j8t,mybelovedz,3,"people are way too scared to go against the way of life we as humans have always known. even if it’s for the greater good. it’d take decades, maybe even centuries for people to gain their own independent opinions and views on our environment. we as a society are a hive mind, whether we’d like to admit it or not. unfortunately, i don’t think we’ll ever be there and if/when we do get there, none of us will be alive to see it"
jtsjirv,Moraulf232,3,You’re wrong. Global warming will not be solved but endured.
jtrz3xq,togtogtog,2,"We already know how to prevent global warming. However, we, as an entire species, find it impossible to act in unison, or to behave in ways which work in the longer term.

I agree with you that leaving it to individual people will not work, because there will always be plenty of people who won't take individual action.

However, it's also perfectly possible to bring about change through changing regulation, and this has been done in the past to good effect with all sorts of things which are harmful to the environment (CFCs, excrement, DDT)

Rather than allowing global warming to make the planet uninhabitable in some regions and far less pleasant in others while waiting for a technological breakthrough which may or may not work, it would be far more logical to change regulations. Therefore, lobbying and political action is an effective place for individuals to take action.

We *are* the human race, and therefore we already know that although we are flexible and adaptable, we aren't that logical or far sighted, in particular when we act as large groups (hell, even as small groups!)."
jtsizar,explain_that_shit,2,"It will cost far less money and diplomatic issues to just convert to a carbon neutral global economy than to moonshot some untested new toy to screw with the climate in some new way. Not to mention that that expensive toy will not sustainably solve the problem, if it solves the problem at all (rather than just creating its own, new problems).

We have the technology to solve the problem. Ignoring that technology in favour of some imaginary new technology just sounds like a child bored with their toys and wanting a new toy for the novelty. ‘Technologists’ need to grow up and get on board with the solutions on the table, because we simply do not have the time for this kind of screwing around."
jtsrebs,PrometheusHasFallen,2,"Energy transition expert here...

I suppose it really depends on what you consider a technological breakthrough and what is just incremental improvements to existing technology.

For electricity, I think the technology is there (or getting there) to use solar and wind with stationary battery storage with some small modular nuclear reactors and peaker natural gas plants to guarantee reliability. Perhaps not 100% decarbonized by close enough.

For transportation, I think lithium-ion batteries can be used in a lot of lighter vehicle use cases. But I think this is more limited and subject to consumer resistance than what a lot of advocates would tell you. Perhaps each private home in the U.S. will have one BEV and one non-BEV vehicle. That's probably the maximum market penetration we'll see in the U.S. in my opinion.

For the remaining transportation use cases and for decarbonizing heavy industry and residential and commercial heating, I really think low-carbon hydrogen will be the key source of energy, either in its natural form or as a derivative like ammonia or methanol. Hydrogen costs are tied to renewable power and natural gas costs and there is a TON of investment going on right now to make it competitive vs. diesel and gasoline. And I think it will be by the 2030s.

Lastly, we do have pretty serious investment and technology in the realm of carbon capture and electrification of technologies. Maybe direct air capture is a ways off but at least in certain locations that have abundant geothermal energy like in Iceland, they could just keep on sucking CO2 out of the atmosphere indefinitely. But the vast majority of carbon capture will be on concentrated emissions sources at industrial facilities. The technology is there. It just costs money and needs to get past the NIMBYism."
jtt4pxq,DSMBCA,2,"I agree with you on this.  With all the targets we have set globally it's really just lip service in the grand scheme of things.  The countries that matter in Asia and Africa with the largest populations as their wealth increases they want the quality of life we have enjoyed in the west.  They don't really give a rip about climate targets - if we decimate our economy to save the world they are just going to steam roll us and carry on with the status quo!  

That being said I don't think we should do nothing - it's important to invest and INNOVATE in clean technologies. With AI there is some risk but I think there is a lot of potential when you literally have infinite intelligence.  I don't think we comprehend what that means for humanity."
jttn1jg,Lucosis,2,"We're not going to stop the bath from overflowing until we learn how to unstop the drain; that doesn't mean we don't bail out to the sink until we figure it out.

The path we're on now, we *need* some massive breakthroughs to solve the problem and return to the life we had before. We have to do everything we can to slow the problem so we have enough time to solve the problem."
jtto6tx,Redwolf193,2,"Agree with first half, second half I don’t. All the technology to help mitigate climate change and become carbon neutral already exists, it’s just a matter of actually deploying it to scale and refining it. Nuclear, wind, solar. The tech necessary to provide energy for our world already exists, and only needs finite tuning and deployment. We are already looking into gene editing a species of poisonous peas by removing the toxic aspect and making it safe for consumption. This particular plant reinvigorates the soil and is extremely resilient. If the poison aspect can be removed, it can easily become a staple food source for the world even if things do go tits up. All the technology to save society and then some already exists, the problem is sociological in nature. It requires some fundamental changes to society and our role on the planet as a whole, as well as some temporary discomfort in the interim as we transition. Oil companies need to be held accountable too, as they knew the risks since the 80s but kept things business as usual despite that, even actively pushing out/funding disinformation (sort of like how the cigarette companies used to do). I don’t think there is any tech breakthrough that could be made that can fix this, it requires getting people, politicians, and businesses all on board unfortunately. I think it can be done, but it definitely isn’t going to be easy"
jttt0h3,yinyanghapa,2,Waiting for superman?  Many rich people seem to either want to get [bunkers](https://www.theguardian.com/news/2022/sep/04/super-rich-prepper-bunkers-apocalypse-survival-richest-rushkoff) or start colonizing other planets and moons rather than save the climate.
jtsfzbd,Thenotsogaypirate,1,"Fortunately, some big, fantastic, technological breakthrough has just occurred in the past week that is currently being verified that would go a long way towards solving global warming. 

100% energy efficient wiring on its way

https://www.science.org/content/blog-post/breaking-superconductor-news"
jtsikal,Mafik326,1,I would argue that it's about removing some existing technology from our lives. Make trains and bikes not cars.
jts36ka,FinneousPJ,1,In the absence of a perfect solution it's best to adopt a good solution.
jts64qm,Leading-Okra-2457,1,"I wish there was a technology that exclusively destroys most non eco friendly people in the world.

/hj"
jtsb72g,IvanSaenko1990,1,"Climate change will not be solved period, we'll just have to live with it's consequences."
jtskpzz,Significant-Trouble6,1,It’ll be over when people stop making big money off it by fooling the easily manipulated
jtsotdv,liberal_texan,1,"Unfortunately if you look at how humans have handled resources in the past, climate change is most likely to be handled by either running out of fossil fuel or by massive widespread population collapse."
jtsotoz,Potential-Ad1139,1,"Kind of a lazy point of view that seats away any personal accountability. Kind like saying ""the doctor will save me if I get a heart attack, imma eat this 24oz steak""."
jtspn2o,tamman2000,1,"I think where you're wrong here is suggesting that it will be solved.

Our society has shown no willingness to either make the changes required to avert climate disaster or to invest in the kinds of ideas that could substantially mitigate the impacts.

We're in for a rough time in the next couple decades when we start to get mass crop failures and coastal areas become untenable for long term habitation."
jtsq1jx,Fluid_Substance8473,1,Hybrid cars and less agricultural methane could have maybe helped a long long time ago.
jtssan3,jakeofheart,1,"Not really going to try to change your view on the first item (I agree that small changes are not enough), but on the second one.

We don’t need new technology, we need less.

Everyone in post-industrial countries should be forced to scale down their consumption to 1950s level.

* Single use plastics should be taxed into oblivion, and we should be forced to use wood pulp, glass, ceramic or metal packing.
* Single use goods in general should be heavily taxed, to the point where it is cheaper to buy durable and repairable alternatives.
* International trade agreements on private consumption goods should be revoked. Protectionists custom duties should be implemented.
* Companies should be forced to manufacture in the market where they sell, like it is done in Brazil or India (through salty import fees on finished goods) or in China.

The workforce that is let go by a wound down retail industry could be redirected towards domestic manufacturing and services.

[Global greenhouse gas emissions by sector](https://ourworldindata.org/uploads/2020/09/Emissions-by-sector-%E2%80%93-pie-charts-768x727.png)"
jtsvvkn,JerRatt1980,1,"No. It will never be ""solved"". That's because the sensationalism surrounding it is too politically beneficial to the growth of government power, regulation, and taxes that they'd never ever let it be deemed it was anything but ""we're at the point of no return and the future is doomed""."
jtsxj79,sahuxley2,1,"> small changes to be more environmentally friendly such as buying a hybrid vehicle or eating less meat are next to useless. Seriously, does anyone actually think this will fix things?

Small changes are worthwhile even if they don't completely ""fix things.""  They can buy us time to come up with the breakthrough solution."
jtszuz0,stewartm0205,1,"We already have the technological breakthroughs: renewable energy, Electric vechicles, and heat pumps. It's just a matter of building enough new units to replace the old fossil fuel units. Renewables will take 10 more years, Electric vehicles will take 20 more years, and heat pumps will take 40 more years."
jtt0cir,HughJazzKok,1,"We are more likely to make contact with aliens than solving anything climate related in any meaningful way. 

This is just the reality there's no point worrying about what can't change."
jtt0o15,agnostichymns,1,"Global warming will not be solved.
The planet will continue to warm as a result of our actions and inactions, the climate and environment are irrevocably damaged, and millions of species developed through billions of years of careful evolution will go extinct.

One day the microscopic organisms that survive what humans have done might crawl out of the new primordial ooze and start it all again, using the oily bones of our society to fuel its own rise to power."
jtt1x89,Aubagne2023,1,"It's too late to stop the warming. I think mitigation is our only hope. That would involve:

1. Immediate cessation of all development along waterfronts (oceans, rivers, lakes, etc).  Then buying out folks in vulnerable areas (i.e. beach homes in the Carolinas).  

2.  Emergency funds to all coastal cities for surface water disbursement, to include   
wastewater treatment improvements.  

  3.  Improvement of our grids, which are being overstressed due to heat.  

Small, but important steps to relieve what is coming."
