Comment_ID,Author,Score,Text
jtt26dt,TheLotusDom,1,"Technically speaking, you are correct that small incremental changes will not make a big difference, and frankly some of the proposed changes such as cutting back red meat are impractical and defies human evolution and psychology, it causes unnecessary suffering and adds only to the resistance against green energy.

The big -but- is that this line of thought ignores the domino affect those small changes have on the economy and evolution of green living and energy. We made slingshots before we made interplanetary vehicles. We need the economy and support starting with small business startups before we can have the economy and support for a planetary wide cleanup and green energy network.

We currently have the technology to completely make the planet green and reverse climate change. The catch being that the technology for that (carbon capture, solar, wind ect.) at current cost and economy of making it, would be around 350,000,000,000,000 USD (I am no professional in the matter, this is a seriously rough estimate based on the few non-biased articles I have read on the subject), which is more money than exists on the entire planet. This number is based on our current pollution rate.

No carbon tax will ever pay for that however. The framework is there for success, these small increments every year lower the cost of that by trillions of dollars and gives companies and researchers the money necessary to create the infrastructure and technology required to make this plausible.

If everyone on earth switched to electric cars, it would be lowered by around 1/3rd. If green renewable energy completely removed fossil fuels, it would cut a third from that price. If one of these startups successfully made fusion technology, it would cut the cost upwards of 70%. After a while we aren't talking about an unfathomable amount of money, suddenly we are down to 10,000,000,000,000 which while staggering, would be easily accomplished with a global effort.

Each drop in the bucket matters, but it is convoluted on how it actually matters."
jtt2hmj,shumpitostick,1,"Global warming is made up of many different sources of greenhouse gas emissions. There's fossil fuels, but there's also agricultural emissions, emissions from industrial processes, deforestation, etc. How would a technological breakthrough solve all of these things at once?"
jtt5tbx,DiplodocusSmile,1,I think you can shorten this to “global warming will not be solved”
jttb4he,AmongTheElect,1,"Global warming is inexorably tied to government. It'll never be ""solved"" because the government will always declare that there's some new problem with it that they must be given money and power to fix."
jttg535,vanoroce14,1,"Global warming will not be solved by small, piecemeal, incremental changes to our way of life OR by some big, fantastic, technological breakthrough. IF we are to even mitigate climate change and to adapt to however much is inevitable, what is required is some big, fantastic, systemic change in *human behavior and economic / political systems*. 

I am not underestimating human ingenuity and resourcefulness, but I also don't think we should overestimate it. If we continue our model of hyperconsumption and infinite growth, we will continue to cause troubles for ourselves and for other species in our planet. Something has got to give. 

Also, as someone who knows a thing or two about physics modeling, I can tell you that pumping a complex system like the Earth with energy is a very bad idea, and it is incredibly difficult to model what will happen mid to long term. We should thus be wary of putting our eggs on some magical tech solution that magically reverses things. We could as easily mess things up even further with such a technology."
jttsmtw,ZestycloseCup5843,1,"Climate change is going to be solved by only dealing with its consequences at the last possible second or until it becomes financially inconvenient. 

It's not a coincidence all these oil companies admitted climate change was real the moment they were on the short end of the profit stick and their insurance stopped backing them."
jtttb56,AAPgamer0,1,Of course. But the current goal shouldn't be to stop global warming completly. That would be impossible without returning to the 18th century. But we should mitigate it's effect  by reducing our green house gas emissions untill the nessesary technlogy are available to completly stop climate change. That's what i think at least.
jttu7zs,EH_Operator,1,"Yeah, it’ll be when mobs break-through gates to palatial private neighborhoods, when organized guerrillas break-through security forces surrounding billionaire oligarchs, when streets packed with civilians break through city hall doors and police department barricades, and when the people responsible for setting us all up to boil alive are lined up on a dock by the angry sea and their wretched little skulls have breakthrough after breakthrough before they’re dumped off to Poseidon. Nothing short of that will work."
jttuk0t,gerryf19,1,"Even if there were some technological breakthrough it requires the will to investigate and implement

That cannot happen when we literally have people fighting against developing such methods --bit to mention there is a significant population who absolutely deny global climate change is a thing"
jttvz4l,almightySapling,1,">We are the human race and we’re nothing if not flexible and adaptable when push comes to shove.

Your hubris has caused you leave out one very, very likely outcome: *we don't solve it*.

Sorry, but this is an adult conversation and I think it's very silly when adults pretend that humans are magic. That we have an innate ability to solve every problem thrown our way. As if no tribe were wiped out by another. As if no mass starvation events have ever occurred.

We don't solve all our problems. We have tons of unsolved problems that brilliant minds have spent collective millennia working towards.

The best you can say about us is that we, as a species, haven't gone extinct yet. That makes about as smart as wheatgrass, and no smarter.

Waiting for major technological breakthrough is going to doom us, it allows us to put up a ""Somebody Else's Problem"" field and go about our merry business. Waiting for some ubiquitous Them to come along and make it all better."
jttw7jm,ChironXII,1,"Climate change is fundamentally an incentive problem (tragedy of the commons) much more than it is a technological problem - the cost of polluting is externalized, while the benefit is privatized. Thus, the solution is one that corrects this - such as a carbon equivalent tax combined with tariffs against non-participating countries.

The reason this works is that it weaponizes the market system *against* the problem, rather than trying to wage a futile policy war against the undefeatable profit motive.

The costs of goods and services that contribute to the problem would increase, and anybody who could do the same thing with less pollution would be able to collect a huge profit, which creates much more incentive than any government program can. In addition the funds raised can be used to fund a citizen's dividend to offset the cost, and/or used for funding other mitigating initiatives."
jtu5m2k,sdbest,1,"Your CMV post is based on two unrelated ideas, and what may be a false premise. 

The first is global heating *will not* be solved by small, piecemeal, incremental changes. And, two, global heating *will or can* be solved by ""some big, fantastic, technological breakthrough."" 

Also, there is an unstated premise in your view which is that global heating can, in fact, be solved. Every indication, so far, is that it cannot be solved in a way that would prevent catastrophic impacts on human civilization and humankind itself.

I suggest there is no factual  bases for any of the premises upon which your view is based.

First, catastrophic weather related events may so damage civilization, as we know it, that what is left will only be capable of a much smaller effect on the biosphere.

Second, there's no evidence of any breakthrough technology that could reduce the CO2 and other GHGs in the atmosphere sufficiently to reverse global heating. At best what appears possible is a slowing down of the rate of heating.

Third, there's no evidence to suggest humankind is capable of implementing any measures that would reverse global heating.

Global heating may so degrade human civilization that we'll stop adding CO2 to the atmosphere, but even if human civilization ends it would be tens of decades before the biosphere reduced the concentration of GHGs sufficiently to lead to climate cooling."
jtu74tb,96-62,1,"No, it will be solved by concerted action to decarbonise the economy, across private, public and individual spheres."
jtu7zd3,Pesty_Merc,1,"And that ""big breakthrough"" is using nuclear power, and forcing other countries (China, India) to pollute less."
jtu9ogv,2211Seeker,1,"My understanding is that the pandemic crushed the world economy for around 18 months, and this had zero effect on warming.   The idea that Russia, India, China and the Mid-East countries would cooperate to lower emissions sounds like a fantasy.   At this point, it seems like a scam to get higher taxes and more regulation in place, and when the science shows no alleviation of warming, the taxes and regulations won't be repealed.   Or the ""science"" will be massaged to show the ""right"" results."
jtuaesh,amrakkarma,1,"This is a problem that requires a change in the way we think. Not anymore a super hero,  a silver bullet, a single man at the lead. These are machista ways of seeing the world, that are in part causing this issue, because they implicit carry values of domination, extractivism and inequality. We need to accept that the solution will come from communities, by slowing down, decentralising power, building stronger connections with people around us and with the nature.

In other words, solarpunk."
jtuaqh5,keeping_the_piece,1,"You’re talking about Techno Solutionism - the desire to jump on technological solutions as a quick and flawless way to solve complex real world problems.

Techno solutionism is problematic because its roots run deep and it’s incredibly hard to weed from public discourse once it has been introduced. It’s often politically appealing to solve issues an electorate is buzzing about by “investing” money to tackle the issue. Across government, money is thrown at issues in completely irrational attempts to disrupt reality. Yet these technological solutions are too often designed around simplified use cases, not complex abuse cases. Without a clear grounding in reality, these solutions cause harm to the same people they were naively intended to protect. 

The reality is that almost any technical advance has benefits and harms. Often the benefits and harms are unevenly distributed – one group may reap most or all of the benefits while others receive all or most of the harm.

We cannot hedge our bets on creating a non existent technology to fix the problems caused by modern day technology: heat and waste.

De-growth is the only real way to offset the effects of climate change."
jtubbtg,plantaloca,1,"It’s a matter of us electing leaders that are already aligned with human well being. 

New technologies will help but they cannot solve it all at once. It’s combination of new regulations, consumer behavior and lifestyle. We all are a little too polarized to cooperate and work together."
jtuckrg,greenfrogfox,0,"So in other words, global warming was not caused by small man made things like Diesel engines, coal supplied power plants, burning of fossil fuels."
jtud3gq,some-random-number,1,I think we need to just have more ways to compensate all that causes ho2 pollution. Like how we can travel with being eco friendly. Not just reducing all travelling. That is the kind of thecnology that will change our future. Also we cant just collect the pollution from the air. That doesnt help us anywhere.
jtuhtij,Jumpy-Author-4985,1,"There will be no solving climate change,  we are way past that point"
jtuj3es,TheRadBaron,1,"Science isn't magic. We can't predict exactly what future innovations will happen, but we are actually pretty good at understanding certain limits. We can't travel through time, we can't go faster than the speed of light, we can't build wings that let people fly around using their own muscle power, we can't build perpetual motion engines.

It takes lots of energy (and infrastructure and political will) to pull carbon out of the atmosphere and bury it underground. It will *always* take more energy to emit and re-capture carbon, than to not emit it in the first place. There are basic thermodynamic laws at play here, we will never invent a cheat code that lets us fix things without serious effort. The longer we wait, the more effort is required, and the smaller the payoff. 

>We are the human race and we’re nothing if not flexible and adaptable when push comes to shove.

Countless human civilizations have collapsed due to extremely small changes in local climates. It's easy to forget, because it was always a local thing, and human beings elsewhere were thriving, but humans constantly come up against this kind of issue and fail. Entire societies gone, an effective extinction from their own perspective.

Global climate devastation is a new issue, there are no humans elsewhere to thrive if we die. Global political instability in the presence of nuclear weapons is also untested."
jtujupe,Sedu,1,"There is no one thing that will save us *if anything does*. Keep in mind that our salvation is not some kind of foregone conclusion. Civilization might simply fall. There is nothing which says that is impossible.

Small, piecemeal changes buy us time, which we desperately need. If our world collapses before we come up with that technological savior that you're hoping for? We're screwed."
jtujy71,Awkward_Document_515,1,"I said this on another thread, but I think the solution (not a politically popular option) is to invest in clean energy for developing countries. Developing countries don’t have the means or financial resources to change there energy systems. This plan is outlined within the Paris climate accord where richer countries invest in developing countries energy mix, but it’s underfunded. I think if you can get a developing countries on a similar energy mix to a wealthier nation this would help mitigate the effects of climate change and we already have the technology to do it. Unfortunately this would require world wide cooperation and this hasn’t happened to date"
jtul8bx,PIeseThink,1,This is 100% facts. Reddit scientists have no clue when they’re talking about when it comes to climate change and global warming. Only thing that can save us at this point is some type of technological break through in which that is space travel or atmosphere manipulation.
jtunalv,DanfromCalgary,1,Sounds like this doesn't recycle
jtuqwvh,zmamo2,1,"Just going to add tha, while new technological breakthroughs would help tremendously, we have already come across the technical breakthroughs required for the transition away from fossil fuels.  

Solar panels are now the cheapest form of energy humans have ever created. That combined with incredible improvements in battery technology, heat pumps, and electrolyzers means that the transition is more an issue of implementation rather than one of discovery."
jturqqn,YamaShio,0,"Based on what? Your hopes and fears? Its not HOW we'll solve climate change, it's IF.  
No, we might not solve it with small incremental changes. But that means it's likely we'll fail and all DIE, not invent magic."
jtv3ta0,Majestic_Return3052,1,"Most people won't take the time,.effort, or money to change their everyday lives. They don't care. People don't care about a problem until it's half an inch from their face"
jtv4xmx,Competitive-Initial7,1,Your belief is premised on the assumption that global warming will be solved. Humans have proved time and again they value sensationalism and politics over science. We are willingly laying the groundwork for an extinction era...
jtv682t,lkattan3,1,"Ecological economists have repeatedly said Incremental won’t save us and neither can we bet on innovation saving us. Both of these ideas are in the vein that capitalism must remain to have a livable planet, that continual GDP growth is a necessity to well-being (although pursuing growth makes the task of a sufficiently rapid renewable transition impossible). GDP is irrelevant to human well-being and nearly half of all the resources we use, and half of all the emissions we emit, is done in order to make rich people richer. Economic growth is the primary driver of the problem and that can be addressed but it won’t be incremental nor will it be innovative. We need degrowth.

“[The power of universal public services is that we can improve people’s access to goods necessary for decent living, with provisioning systems that require less aggregate energy and material use and which allow us to accelerate decarbonization.  These outcomes can be further enhanced by ensuring strong democratic governance of public systems. Together with the job guarantee, economic insecurity is permanently abolished — accomplishing a goal that growth alone has never been able to achieve — and human well-being is de-linked from the requirement of ever-increasing aggregate production.  This would change the political landscape, freeing us to pursue necessary climate action without any risk to employment and livelihoods, while improving social outcomes, reducing inequality and facilitating a shift toward a more just and ecological economy](https://www.jasonhickel.org/blog).”

Public control over provisioning systems makes it easier to achieve rapid decarbonization. The idea is to allocate resources and energy more rationally, and more democratically, to enable everyone to live flourishing lives in balance with the ecosystems we depend on."
jtvi49c,jordanapolis,1,I guess our carbon emissions will go down drastically once it's too hot for humans to do all the work required to consume fossil fuels
jtvqzrf,PdxPhoenixActual,1,And not even that. It was too late a couple of decades ago.
jtw52vm,Malcontent2-55,1,"Yea, if only we had clean nuclear power on a large scale."
jtwid9o,Flowers1966,1,"First of all I think that global warming is both true and a myth. Climate has always changed. Some deserts during biblical times were fertile farmlands. 

Too many of the current solutions to ‘global warming’ are not efficient or cost effective. The solutions being proposed have environmental problems. We do not have enough centers to reprogram solar panels so that many outdated solar panels go to trash. Electric cars are not cost effective or convenient. Windmills kill wildlife. 

Should we try to find better energy? Of course. But should we advance false solutions? Of course not."
jtx071s,p1-KateHowe,1,"While small changes like driving hybrids or reducing meat consumption may not solve global warming on their own, they're still important steps. We can't overlook their collective impact. However, I'm all in for that big technological breakthrough you mentioned! Whether it's glitter in the sky or fusion power cleaning the air, we need some innovation. As the human race, we've shown resilience before, and I believe we can find a way to tackle climate change with creativity and ambition."
jtx6c5h,Deleted,1,"It's 2024. We should have unlocked the Arcology by now, and we'll have microwave power in a few years. That should help."
jtxd32n,Radiant_Practice5176,1,Artificialization is our main trouble. We have artificialized all our major environments and yet to resolve it.
jtxggah,Barnfred_Knarst,1,"I agreed up to the word ‘technological’. The breakthrough we need is systemic. We need to change the way we design our society: as long as we do not change the current power structures, the aim for GDP growth and our consumer mindset, I do not believe it is possible to achieve meaningful change. Technological breakthroughs usually enforce these old systems and therefore I do not see that working in the long run."
jtxgm4t,ovastvnas,1,cool
jtz6zk0,ghotier,1,"If I told you that you were half right, would that potentially change your view? Because you're right, it won't be solved by incremental change, because it won't be solved."
ju0fe0t,snide_soul,1,"I don't think you would want to do any ""blocking out the sun"". The earth isn't getting warmer, it's actually getting colder. Colder winters are coming along. Countries that have never gotten snow are getting snow. We have a higher chance of entering an Ice Age then this ""global warming"" coming true. Granted, yes, we are poisoning the air with rich people flying their private jets back and forth across the world, and that needs to be stopped. You know what also needs to be stopped to prevent that though? **People need to stop burning down forests and saying ""Oh, global warming caused these fires!"".**"
